### ISSUE TITLE
Flannel internal

### ISSUE THREAD

**Issue by sw-cho** [sw-cho/study#4]
# Flannel internal

> **목표**

**실습을 통해서 flannel cni 분석**

## Flannel 소개 
Flannel 은 k8s를 위해서 L3 network 를 구축해주는 간단한 CNI plugin 이다.
Flannel은 각 호스트에 `flanneld`라는 하나의 에이전트가 실행되고, `flanneld` 가 미리 구성된 더 큰 주소 공간 중에서 서브넷 리스를 각 호스트에 할당하는 역할을 담당합니다.

Flannel overlay 네트워크를 구현하는 backend 는 VXLAN, host-gw, UDP 가 있다. 그 외에는 실험적인것들이 몇개 있다. (https://github.com/flannel-io/flannel/blob/master/Documentation/backends.md)
- host-gw: L2 에서 동작. 모든 호스트가 같은 서브넷에 존재해야한다. 그래도 가장 빠르다.
- **VXLAN (권장): Use in-kernel VXLAN to encapsulate the packets.
  - 다른 노드의 파드와 통신 시 VXLAN, 같은 노드의 파드와 통신 시 DirecRouting 지원**
- UDP (비권장) : VXLAN 지원하지 않는 오래된 커널 사용 시, Port(UDP 8285) 

## Flannel manifest 분석 

flannel configmap 설정에는 `cni-conf.json`, `net-conf.json` 이 있다.
`cni-conf.json` 는  cni 설정이고, (어떤 플러그인을 사용할 것인지), `net-conf.json`는 flannel 의 네트워크 설정이 담겨있다. (backend 네트워크 설정과 podCIDR 설정이 있다.)
이 `net-conf.json` 설정 파일은 `flanneld` 파드의 arg 가 ` --kube-subnet-mgr=true` 인 경우에 의미가 있다. `false` 인 경우 설정 파일을 etcd의  `/coreos.com/network/config` 경로 에서 읽게 된다. 

<details> 
<summary>flannel configmap 설정 확인</summary>

```
kind: ConfigMap
apiVersion: v1
metadata:
  name: kube-flannel-cfg
  namespace: kube-system
  labels:
    tier: node
    app: flannel
data:
  cni-conf.json: |
    {
      "name": "cbr0",
      "cniVersion": "0.3.1",
      "plugins": [
        {
          "type": "flannel",
          "delegate": {
            "hairpinMode": true,
            "isDefaultGateway": true
          }
        },
        {
          "type": "portmap",
          "capabilities": {
            "portMappings": true
          }
        }
      ]
    }
  net-conf.json: |
    {
      "Network": "10.244.0.0/16",
      "Backend": {
        "Type": "vxlan"
      }
    }
```
</details> 

Daemonset 에는 `install-cni`, `install-cni-plugin` 두 개의 initcontainer 가 동작한다.
각각은 kubelet 이 컨테이너를 실행시킬 때 필요한 설정 및 바이너리를 호스트에 복사한다. 

- `install-cni` 는 `/etc/cni/net.d/` 에 kubelet 이 읽을 CNI 설정 파일을 저장한다. 
  - `--cni-conf-dir string     Default: /etc/cni/net.d`
- , `install-cni-plugin`는 `/opt/cni/bin/` 에 flannel 플러그인을 설치한다.  
  - --cni-bin-dir string     Default: /opt/cni/bin`
  
`flanneld` 컨테이너는 각 호스트에 네트워크 설정을 수행한다. (`flannel.1`, `cni0` 인터페이스 생성, 라우팅 정보 생성)
<details> 
<summary>flannel daemonset 설정 확인</summary>

```
apiVersion: apps/v1
kind: DaemonSet
metadata:
  name: kube-flannel-ds
  namespace: kube-system
  labels:
    tier: node
    app: flannel
spec:
  selector:
    matchLabels:
      app: flannel
  template:
    metadata:
      labels:
        tier: node
        app: flannel
    spec:
      affinity:
        nodeAffinity:
          requiredDuringSchedulingIgnoredDuringExecution:
            nodeSelectorTerms:
            - matchExpressions:
              - key: kubernetes.io/os
                operator: In
                values:
                - linux
      hostNetwork: true
      priorityClassName: system-node-critical
      tolerations:
      - operator: Exists
        effect: NoSchedule
      serviceAccountName: flannel
      initContainers:
      - name: install-cni-plugin
        image: rancher/mirrored-flannelcni-flannel-cni-plugin:v1.0.0
        command:
        - cp
        args:
        - -f
        - /flannel
        - /opt/cni/bin/flannel
        volumeMounts:
        - name: cni-plugin
          mountPath: /opt/cni/bin
      - name: install-cni
        image: rancher/mirrored-flannelcni-flannel:v0.16.1
        command:
        - cp
        args:
        - -f
        - /etc/kube-flannel/cni-conf.json
        - /etc/cni/net.d/10-flannel.conflist
        volumeMounts:
        - name: cni
          mountPath: /etc/cni/net.d
        - name: flannel-cfg
          mountPath: /etc/kube-flannel/
      containers:
      - name: kube-flannel
        image: rancher/mirrored-flannelcni-flannel:v0.16.1
        command:
        - /opt/bin/flanneld
        args:
        - --ip-masq
        - --kube-subnet-mgr
        resources:
          requests:
            cpu: "100m"
            memory: "50Mi"
          limits:
            cpu: "100m"
            memory: "50Mi"
        securityContext:
          privileged: false
          capabilities:
            add: ["NET_ADMIN", "NET_RAW"]
        env:
        - name: POD_NAME
          valueFrom:
            fieldRef:
              fieldPath: metadata.name
        - name: POD_NAMESPACE
          valueFrom:
            fieldRef:
              fieldPath: metadata.namespace
        volumeMounts:
        - name: run
          mountPath: /run/flannel
        - name: flannel-cfg
          mountPath: /etc/kube-flannel/
        - name: xtables-lock
          mountPath: /run/xtables.lock
      volumes:
      - name: run
        hostPath:
          path: /run/flannel
      - name: cni-plugin
        hostPath:
          path: /opt/cni/bin
      - name: cni
        hostPath:
          path: /etc/cni/net.d
      - name: flannel-cfg
        configMap:
          name: kube-flannel-cfg
      - name: xtables-lock
        hostPath:
          path: /run/xtables.lock
          type: FileOrCreate
```

</details> 

Flannel 설정은 아래에 자세히 나와있다. 
(https://github.com/flannel-io/flannel/blob/master/Documentation/configuration.md)

## Flannel 실습

> **실습 환경**
- k8s v1.22.5
- master 1ea, worker 2ea
-  vNIC1 용도(다른 PC에서 VM 인입 접근 시, VM에서 외부 통신 시   10.0.2.0/24), vNIC2 용도(k8s 관련 제어 및 Pod 간 통신 등 k8s 192.168.100.0/24)

![image](https://user-images.githubusercontent.com/66065293/150949574-2a8128d0-689c-4350-9555-0b5f5463ca8c.png)

<details> 
<summary>실습 환경 배포</summary>

  ```bash
  K8S 배포에 사용할 폴더(디렉터리)를 생성 후 사용해주세요
  # vagrant 파일 다운로드
  curl -O https://raw.githubusercontent.com/gasida/KANS/main/2/Vagrantfile
  
  # 배포
  vagrant up

  # 배포 확인
  vagrant status
  
  # ssh 접속 : 참고(root 계정암호: qwe123)
  ## 마스터노드 접속
  vagrant ssh k8s-m
  
  ## k8s 클러스터에 노드 확인
  kubectl get nodes
  NAME     STATUS   ROLES                  AGE     VERSION
  k8s-m    Ready    control-plane,master   3m27s   v1.22.5
  k8s-w1   Ready    <none>                 99s     v1.22.5
  k8s-w2   Ready    <none>                 99s     v1.22.5
  
  kubectl get pod -A
  
  ## 워커노드 접속 : 참고(root 계정암호: qwe123)
  vagrant ssh k8s-w1
  vagrant ssh k8s-w2
  ```

 </details>

## Flannel 기본 정보 확인
- 호스트에서 flannel 정보 확인 : 대역, MTU
Flanneld 가 시작되면 podcidr 및 기타 네트워크 관련 세부 정보를 apiserver에서 가져와 `/run/flannel/subnet.env` 파일에 저장함
```
$ cat /run/flannel/subnet.env
FLANNEL_NETWORK=172.16.0.0/16
FLANNEL_SUBNET=172.16.1.1/24
FLANNEL_MTU=1450  // vxlan 관련 헤더 제외 1450 
FLANNEL_IPMASQ=true
```

- 워커 노드마다 할당된 dedicated subnet (podCIDR) 확인
cni 는 공통적으로 워커 노드마다 할당된 subnet 이 다름. 왜냐 pod 마다 독립적인 ip 를 가져야하고, 이를 위해서 노드마다 서브넷이 다름. 
```
$ kubectl get nodes -o jsonpath='{.items[*].spec.podCIDR}' ;echo
172.16.0.0/24 172.16.1.0/24 172.16.2.0/24

$ kubectl get node k8s-m -o json | jq '.spec.podCIDR'
"172.16.0.0/24"
$ kubectl get node k8s-w1 -o json | jq '.spec.podCIDR'
"172.16.1.0/24"
$ kubectl get node k8s-w2 -o json | jq '.spec.podCIDR'
"172.16.2.0/24"
```

- 호스트 인터페이스 정보 확인
`flannel.1.` 은 VXLAN 에서 VTEP 역할을 하는 인터페이스로, VXLAN encap, decap 이 이루어짐. 
컨테이너의 veth pair 를 연결해주는 `cni0` bridge interface 가 보여야하는데, 이는 파드가 한번이라도 배포되기 전까지 생성되지 않는다.
```
$ ip -c -br addr
lo               UNKNOWN        127.0.0.1/8 ::1/128
enp0s3           UP             10.0.2.15/24 fe80::31:14ff:fe45:3203/64
enp0s8           UP             192.168.100.101/24 fe80::a00:27ff:fe3f:a59/64
docker0          UP             172.17.0.1/16 fe80::42:d2ff:fee3:8d2d/64
flannel.1        UNKNOWN        172.16.1.0/32 fe80::f45a:29ff:fe8b:1e02/64
```

- 호스트 라우팅 정보 확인
k8s-m `172.16.0.0/24` , k8s-w2 `172.16.2.0/24` 의 podCidr 에 속하는 IP 는 `flannel.1` 라우팅 된다.
```
$ ip -c route
default via 10.0.2.2 dev enp0s3 proto dhcp src 10.0.2.15 metric 100
10.0.2.0/24 dev enp0s3 proto kernel scope link src 10.0.2.15
10.0.2.2 dev enp0s3 proto dhcp scope link src 10.0.2.15 metric 100
172.16.0.0/24 via 172.16.0.0 dev flannel.1 onlink
172.16.2.0/24 via 172.16.2.0 dev flannel.1 onlink
172.17.0.0/16 dev docker0 proto kernel scope link src 172.17.0.1
192.168.100.0/24 dev enp0s8 proto kernel scope link src 192.168.100.101
```

- VXLAN 종단점 VTEP 통신 확인 
타 노드의 파드 IP 대역과 통신하기 위한 Next-Hop IP와 통신 확인(VTEP IP == flannel.1)
```
ping -c 1 172.16.0.0
PING 172.16.0.0 (172.16.0.0) 56(84) bytes of data.
64 bytes from 172.16.0.0: icmp_seq=1 ttl=64 time=0.548 ms
```

- arp table, mac 정보, bridge 정보 확인
`flannel.1` 인터페이스는 다른 노드의 `flannel.1` mac 주소를 갖고 있다. 
```
$ ip -c neigh show dev flannel.1
172.16.0.0 lladdr ba:73:6b:72:a0:ab PERMANENT
172.16.2.0 lladdr de:c8:ac:20:1a:18 PERMANENT

$ bridge fdb show dev flannel.1
de:c8:ac:20:1a:18 dst 192.168.100.102 self permanent
ba:73:6b:72:a0:ab dst 192.168.100.10 self permanent


$ bridge vlan show
port	vlan ids
docker0	 1 PVID Egress Untagged

veth5690826	 1 PVID Egress Untagged

```

- iptables 정보 확인
같은 노드의 컨테이너 끼리 통신이 가능하도록 podcidr 에 속하는 패킷은 forward accept.

```
iptables -t filter -S | grep 172.16.0.0
	-A FORWARD -s 172.16.0.0/16 -j ACCEPT
	-A FORWARD -d 172.16.0.0/16 -j ACCEPT

iptables -t nat -S | grep 'A POSTROUTING'
	-A POSTROUTING -s 172.16.0.0/16 -d 172.16.0.0/16 -j RETURN
	-A POSTROUTING -s 172.16.0.0/16 ! -d 224.0.0.0/4 -j MASQUERADE --random-fully
	-A POSTROUTING ! -s 172.16.0.0/16 -d 172.16.0.0/24 -j RETURN
	-A POSTROUTING ! -s 172.16.0.0/16 -d 172.16.0.0/16 -j MASQUERADE --random-fully
  ...
```

- 노드 정보 중 flannel 관련 정보 확인
노드 annotation 에 flannel 관련 정보가 저장되어 있다.
`flannel.alpha.coreos.com/public-ip` 는 
```
kubectl describe node | grep -A3 Annotations
	Annotations:        flannel.alpha.coreos.com/backend-data: {"VNI":1,"VtepMAC":"1e:81:fc:d5:8a:42"}
	                    flannel.alpha.coreos.com/backend-type: vxlan
	                    flannel.alpha.coreos.com/kube-subnet-manager: true
	                    flannel.alpha.coreos.com/public-ip: 192.168.100.10
	--
	Annotations:        flannel.alpha.coreos.com/backend-data: {"VNI":1,"VtepMAC":"72:b6:ba:6d:8a:9f"}
	                    flannel.alpha.coreos.com/backend-type: vxlan
	                    flannel.alpha.coreos.com/kube-subnet-manager: true
	                    flannel.alpha.coreos.com/public-ip: 192.168.100.101
	--
	Annotations:        flannel.alpha.coreos.com/backend-data: {"VNI":1,"VtepMAC":"b6:31:e7:a9:e8:fc"}
	                    flannel.alpha.coreos.com/backend-type: vxlan
	                    flannel.alpha.coreos.com/kube-subnet-manager: true
	                    flannel.alpha.coreos.com/public-ip: 192.168.100.102
```

![image](https://user-images.githubusercontent.com/66065293/151296640-fc607746-d9f4-4066-a28c-b725ee01e616.png)

### 같은 노드에 있는 파드 통신 

<details> 
<summary>예제 파일</summary>

```
cat <<EOF | kubectl create -f -
apiVersion: v1
kind: Pod
metadata:
  name: pod1
  labels:
    app: pod
spec:
  nodeName: k8s-w1
  containers:
  - name: netshoot-pod
    image: nicolaka/netshoot
    command: ["tail"]
    args: ["-f", "/dev/null"]
  terminationGracePeriodSeconds: 0
---
apiVersion: v1
kind: Pod
metadata:
  name: pod2
  labels:
    app: pod
spec:
  nodeName: k8s-w2
  containers:
  - name: netshoot-pod
    image: nicolaka/netshoot
    command: ["tail"]
    args: ["-f", "/dev/null"]
  terminationGracePeriodSeconds: 0
EOF

```
</details> 

- 파드 배포 상태 확인
```
k get po -owide
NAME   READY   STATUS    RESTARTS   AGE    IP           NODE     NOMINATED NODE   READINESS GATES
pod1   1/1     Running   0          5m8s   172.16.1.2   k8s-w1   <none>           <none>
pod2   1/1     Running   0          5m8s   172.16.2.2   k8s-w2   <none>           <none>
```

- k8s-w1 노드에서 bridge cni0 확인
기존에 없던 cni0 bridge interface 가 생성되었고,  pod1 veth pair interface 가 연결되었다. 
```
$ brctl show cni0
bridge name	bridge id		STP enabled	interfaces
cni0		8000.0647e62abb55	no		vethde1ddfe3

$ bridge vlan
port	vlan ids
docker0	 1 PVID Egress Untagged

cni0	 1 PVID Egress Untagged

vethde1ddfe3	 1 PVID Egress Untagged
```

- 라우팅 테이블 확인
자기 자신의 podCIDR 대역에 대해서는 cni0 bridge interface 로 가도록 라우팅 테이블이 추가됨
```
$ ip -c route
default via 10.0.2.2 dev enp0s3 proto dhcp src 10.0.2.15 metric 100
10.0.2.0/24 dev enp0s3 proto kernel scope link src 10.0.2.15
10.0.2.2 dev enp0s3 proto dhcp scope link src 10.0.2.15 metric 100
172.16.0.0/24 via 172.16.0.0 dev flannel.1 onlink
172.16.1.0/24 dev cni0 proto kernel scope link src 172.16.1.1 ## here
172.16.2.0/24 via 172.16.2.0 dev flannel.1 onlink
172.17.0.0/16 dev docker0 proto kernel scope link src 172.17.0.1 linkdown
192.168.100.0/24 dev enp0s8 proto kernel scope link src 192.168.100.101
```

- pod1 에서 interface 확인
pod1 의 eth0 에 대한 veth pair 는 노드에서 9번 interface 에 연결되어 있는걸 확인할 수 있다. ({iface}@if{pair#N})
```
$ ip -c addr show eth0
3: eth0@if9: <BROADCAST,MULTICAST,UP,LOWER_UP> mtu 1450 qdisc noqueue state UP group default
    link/ether e2:17:d6:05:3c:dc brd ff:ff:ff:ff:ff:ff link-netnsid 0
    inet 172.16.1.2/24 brd 172.16.1.255 scope global eth0
       valid_lft forever preferred_lft forever
```

- pod1 에서 routing table 확인
```
$ ip -c route
default via 172.16.1.1 dev eth0
172.16.0.0/16 via 172.16.1.1 dev eth0
172.16.1.0/24 dev eth0 proto kernel scope link src 172.16.1.2
```

- pod1 에서 arp table 확인
```
$ ip -c neigh
## emtpy
```

## Flannel 패킷 캡쳐

![image](https://user-images.githubusercontent.com/66065293/151480553-68162658-57ab-4b48-b670-0526a106bafd.png)

```
$ tcpdump -i cni0
16:57:11.408576 ARP, Request who-has 172.16.1.2 tell 172.16.1.3, length 28
16:57:11.408610 ARP, Reply 172.16.1.2 is-at be:df:27:9f:65:6d (oui Unknown), length 28
16:57:11.408615 IP 172.16.1.3 > 172.16.1.2: ICMP echo request, id 2540, seq 1, length 64
16:57:11.408696 IP 172.16.1.2 > 172.16.1.3: ICMP echo reply, id 2540, seq 1, length 64
16:57:11.486138 ARP, Request who-has 172.16.1.1 tell 172.16.1.2, length 28
16:57:11.486172 ARP, Reply 172.16.1.1 is-at da:a0:17:1a:97:27 (oui Unknown), length 28
16:57:11.486180 IP 172.16.1.2.57050 > 172.16.0.3.domain: 29961+ PTR? 3.1.16.172.in-addr.arpa. (41)
16:57:11.516472 IP 10.96.0.10.domain > 172.16.1.2.57050: 29961 NXDomain* 0/1/0 (114)
16:57:11.588704 IP 172.16.1.2.43606 > 172.16.0.3.domain: 26311+ PTR? 1.1.16.172.in-addr.arpa. (41)
16:57:11.602645 IP 10.96.0.10.domain > 172.16.1.2.43606: 26311 NXDomain 0/0/0 (41)
16:57:11.604257 IP 172.16.1.2.33216 > 172.16.0.2.domain: 60770+ PTR? 10.0.96.10.in-addr.arpa. (41)
16:57:11.605174 IP 10.96.0.10.domain > 172.16.1.2.33216: 60770*- 1/0/0 PTR kube-dns.kube-system.svc.cluster.local. (116)
16:57:16.594678 ARP, Request who-has 172.16.1.2 tell 172.16.1.1, length 28
16:57:16.594698 ARP, Request who-has 172.16.1.3 tell 172.16.1.2, length 28
16:57:16.594787 ARP, Reply 172.16.1.2 is-at be:df:27:9f:65:6d (oui Unknown), length 28
16:57:16.594803 ARP, Reply 172.16.1.3 is-at 7e:95:f8:72:53:a3 (oui Unknown), length 28
```

```
$ tcpdump -i flannel.1
tcpdump: verbose output suppressed, use -v or -vv for full protocol decode
listening on flannel.1, link-type EN10MB (Ethernet), capture size 262144 bytes
16:57:11.774968 IP 172.16.1.2.57050 > 172.16.0.3.domain: 29961+ PTR? 3.1.16.172.in-addr.arpa. (41)
16:57:11.804694 IP 172.16.0.3.domain > 172.16.1.2.57050: 29961 NXDomain* 0/1/0 (114)
16:57:11.877542 IP 172.16.1.2.43606 > 172.16.0.3.domain: 26311+ PTR? 1.1.16.172.in-addr.arpa. (41)
16:57:11.890715 IP 172.16.0.3.domain > 172.16.1.2.43606: 26311 NXDomain 0/0/0 (41)
16:57:11.892919 IP 172.16.1.2.33216 > 172.16.0.2.domain: 60770+ PTR? 10.0.96.10.in-addr.arpa. (41)
16:57:11.893473 IP 172.16.0.2.domain > 172.16.1.2.33216: 60770*- 1/0/0 PTR kube-dns.kube-system.svc.cluster.local. (116)
```

```
cpdump -i eth0
tcpdump: verbose output suppressed, use -v[v]... for full protocol decode
listening on eth0, link-type EN10MB (Ethernet), snapshot length 262144 bytes
16:57:11.408584 ARP, Request who-has pod2 tell 172.16.1.3, length 28
16:57:11.408609 ARP, Reply pod2 is-at be:df:27:9f:65:6d (oui Unknown), length 28
16:57:11.408682 IP 172.16.1.3 > pod2: ICMP echo request, id 2540, seq 1, length 64
16:57:11.408695 IP pod2 > 172.16.1.3: ICMP echo reply, id 2540, seq 1, length 64
16:57:11.486135 ARP, Request who-has 172.16.1.1 tell pod2, length 28
16:57:11.486144 ARP, Request who-has 172.16.1.1 tell pod2, length 28
16:57:11.486174 ARP, Reply 172.16.1.1 is-at da:a0:17:1a:97:27 (oui Unknown), length 28
16:57:11.486180 IP pod2.57050 > kube-dns.kube-system.svc.cluster.local.53: 29961+ PTR? 3.1.16.172.in-addr.arpa. (41)
16:57:11.516479 IP kube-dns.kube-system.svc.cluster.local.53 > pod2.57050: 29961 NXDomain* 0/1/0 (114)
16:57:11.588700 IP pod2.43606 > kube-dns.kube-system.svc.cluster.local.53: 26311+ PTR? 1.1.16.172.in-addr.arpa. (41)
16:57:11.602662 IP kube-dns.kube-system.svc.cluster.local.53 > pod2.43606: 26311 NXDomain 0/0/0 (41)
16:57:11.604252 IP pod2.33216 > kube-dns.kube-system.svc.cluster.local.53: 60770+ PTR? 10.0.96.10.in-addr.arpa. (41)
16:57:11.605179 IP kube-dns.kube-system.svc.cluster.local.53 > pod2.33216: 60770*- 1/0/0 PTR kube-dns.kube-system.svc.cluster.local. (116)
16:57:16.594697 ARP, Request who-has 172.16.1.3 tell pod2, length 28
16:57:16.594691 ARP, Request who-has pod2 tell 172.16.1.1, length 28
16:57:16.594787 ARP, Reply pod2 is-at be:df:27:9f:65:6d (oui Unknown), length 28
16:57:16.594804 ARP, Reply 172.16.1.3 is-at 7e:95:f8:72:53:a3 (oui Unknown), length 28
```
----
